{"$id":"weather-engine/p0.1-1.3.0/holdout_custody.schema.json","$schema":"https://json-schema.org/draft/2020-12/schema","additionalProperties":false,"properties":{"access_log_hash":{"pattern":"^[a-f0-9]{64}$","type":"string"},"acl_hash":{"pattern":"^[a-f0-9]{64}$","type":"string"},"canonicalization_version":{"const":"json-c14n-lf-v1"},"custodian_id":{"type":"string"},"disposition":{"enum":["SEALED","SCORED","INVALIDATED","RESEALED"]},"manifest_sha256":{"pattern":"^[a-f0-9]{64}$","type":"string"},"pipeline_version":{"type":"string"},"read_count":{"type":"integer"},"schema_version":{"const":"p0.1-1.3.0"},"seal_commit":{"type":"string"},"seal_tree_sha256":{"pattern":"^[a-f0-9]{64}$","type":"string"},"seal_ts_utc":{"type":"string"},"storage_ref":{"type":"string"},"validation_owner_id":{"type":"string"}},"required":["schema_version","canonicalization_version","custodian_id","validation_owner_id","seal_ts_utc","seal_commit","seal_tree_sha256","manifest_sha256","storage_ref","acl_hash","access_log_hash","pipeline_version","read_count","disposition"],"type":"object"}
