{"access_log_hash":"89a1d827c54879bb000a9597bb70e486aec192800e0a3cae41bd7719269f3020","acl_hash":"2b7ce981eee7907dfc42abafa1a39c1a619a53c5417cac6d15478dddfde7dc90","canonicalization_version":"json-c14n-lf-v1","custodian_id":"Gerri Kellman","disposition":"INVALIDATED","manifest_sha256":"2b7ce981eee7907dfc42abafa1a39c1a619a53c5417cac6d15478dddfde7dc90","pipeline_version":"P0.1-CLOSURE-1.0.0","read_count":0,"schema_version":"p0.1-1.3.0","seal_commit":"UNSEALED","seal_tree_sha256":"2b7ce981eee7907dfc42abafa1a39c1a619a53c5417cac6d15478dddfde7dc90","seal_ts_utc":"2026-08-19T23:55:00Z","storage_ref":"NOT_SEALED_SUCCESSOR_REQUIRED","validation_owner_id":"Gerri Kellman"}
